{
  "schemaVersion": "5",
  "configVersion": "2026-06-07-prod-1",
  "routerName": "Landspítali Power BI Router",
  "routerMode": "central-config-static-github-pages",
  "environment": "prod",
  "owner": "Landspítali",
  "basePath": "/Landspitali/",
  "supportLabel": "Landspítali",
  "release": {
    "packageVersion": "1.0.0",
    "releasedAt": "2026-06-07",
    "coreVersion": "2026-06-07-core-1",
    "status": "official-first-production-version",
    "coreAssetFile": "router-core.v20260607-1.js",
    "configAssetFile": "router-config.v20260607-1.js"
  },
  "publicEntry": {
    "name": "Landspítali mælaborð",
    "site": "island.is",
    "pageUrl": "https://island.is/s/landspitali/maelabord",
    "pagePath": "/s/landspitali/maelabord",
    "defaultButtonText": "Skoða mælaborð",
    "logoUrl": "https://images.ctfassets.net/8k0h54kbe6bj/6PHUWW83ZRNXU0ydxQsipf/6f460fab1a36daf4c6faf4e604b4741a/Logo.png",
    "lastVerifiedDate": "2026-06-07",
    "allowedImageHosts": [
      "images.ctfassets.net"
    ]
  },
  "tracking": {
    "enabled": true,
    "endpoint": "https://script.google.com/macros/s/AKfycbxRoNEQwlxQUpxEMGzYizAB0_lP1MdqksGLu4fD7c94rzqUul3MW2_E9VCqeRzLK3wD/exec",
    "schemaVersion": "5",
    "diagnosticsEnabled": false,
    "trackDebugViews": true,
    "trackFallbackClicks": true,
    "trackErrors": true,
    "trackDirectoryViews": false,
    "trackDiagnosticEvents": true,
    "countDebugAsVisit": false,
    "countBotsAsVisit": false,
    "sampleRate": 1,
    "redirectTimeoutMs": 150,
    "transportOrder": [
      "sendBeacon",
      "fetchKeepalive",
      "imageGet"
    ],
    "allowedQueryParams": [
      "dashboard",
      "id",
      "force",
      "view",
      "debug",
      "health",
      "list",
      "dashboards",
      "noredirect",
      "utm_source",
      "utm_medium",
      "utm_campaign",
      "utm_content",
      "utm_term",
      "utm_id"
    ],
    "utmDefaults": {
      "utm_source": "island.is",
      "utm_medium": "public_dashboard_card",
      "utm_campaign": "landspitali_maelabord"
    }
  },
  "routing": {
    "mobileBreakpoint": 768,
    "tabletBreakpoint": 1024,
    "forceParamNames": [
      "force",
      "view"
    ],
    "dashboardParamNames": [
      "dashboard",
      "id"
    ],
    "debugParamNames": [
      "debug"
    ],
    "listParamNames": [
      "list",
      "dashboards"
    ],
    "healthParamNames": [
      "health",
      "status"
    ],
    "noRedirectParamNames": [
      "noredirect",
      "manual"
    ],
    "allowDashboardQueryOverride": false,
    "allowDashboardQueryOverrideOnRoot": true,
    "botStrategy": "desktop-no-visit",
    "previewBotLayout": "desktop",
    "tabletStrategy": "auto-by-orientation",
    "tabletPortraitLayout": "mobile",
    "tabletLandscapeLayout": "desktop",
    "narrowDesktopStrategy": "mobile",
    "fallbackLayout": "mobile",
    "redirectDelayMs": 0,
    "manualLinksInDebug": true,
    "maintenanceMode": false,
    "maintenanceMessage": "Mælaborðið er tímabundið óaðgengilegt.",
    "emergencyFallbackDelayMs": 2500
  },
  "ui": {
    "eyebrow": "Landspítali",
    "buttonText": "Opna mælaborð",
    "defaultTitle": "Opna mælaborð",
    "defaultText": "Augnablik, þú ert send/ur í rétta útgáfu mælaborðsins eftir tæki og skjábreidd.",
    "debugTitlePrefix": "Debug",
    "noDashboardTitle": "Veldu mælaborð",
    "noDashboardText": "Engin dashboard auðkenning fannst í slóðinni. Veldu mælaborð eða notaðu ?dashboard=...",
    "maintenanceTitle": "Mælaborð tímabundið óaðgengilegt",
    "fallbackNote": "Ef ekkert gerist sjálfkrafa skaltu smella á takkann."
  },
  "sourceRules": {
    "islandDomains": [
      "island.is",
      "www.island.is"
    ],
    "internalDomains": [
      "landspitali.is",
      "www.landspitali.is",
      "spitali.is"
    ],
    "knownPreviewBotPatterns": [
      "facebookexternalhit",
      "Facebot",
      "LinkedInBot",
      "Twitterbot",
      "XBot",
      "Slackbot-LinkExpanding",
      "Discordbot",
      "SkypeUriPreview",
      "TeamsExternalLinkPreview",
      "Microsoft Office",
      "Outlook-iOS",
      "WhatsApp",
      "TelegramBot",
      "Googlebot",
      "bingbot",
      "DuckDuckBot",
      "Baiduspider",
      "YandexBot"
    ],
    "knownBotPatterns": [
      "bot",
      "spider",
      "crawler",
      "preview",
      "linkexpand",
      "embedly",
      "quora link preview",
      "pinterest",
      "vkShare"
    ]
  },
  "dashboards": {
    "bradamottaka": {
      "enabled": true,
      "status": "active",
      "dashboardId": "bradamottakan-fossvogi",
      "dashboardKey": "bradamottaka",
      "displayName": "Bráðamóttakan í Fossvogi",
      "routerDisplayTitle": "Bráðamóttakan í Fossvogi",
      "powerBiReportTitle": "Bráðamóttakan í Fossvogi",
      "pageTitle": "Opna Bráðamóttöku í Fossvogi",
      "commentName": "Bráðamóttakan í Fossvogi",
      "path": "bradamottaka",
      "aliases": [
        "bradamottaka",
        "bradamottakan",
        "bradamottakan-fossvogi",
        "brada",
        "bráða"
      ],
      "publicCard": {
        "title": "Bráðamóttaka í Fossvogi",
        "description": "Yfirlit yfir stöðu og þróun á bráðamóttöku",
        "buttonText": "Skoða mælaborð",
        "iconUrl": "https://images.ctfassets.net/8k0h54kbe6bj/68Ef7p57VqG1aYv99GbzB0/3b98fe5c7b3b11c7d01194a7e9caccd6/bradamottaka-linkimage.png?w=774&fm=webp&q=80",
        "pageUrl": "https://island.is/s/landspitali/maelabord",
        "published": true,
        "stableUtmContent": "bradamottakan_fossvogi",
        "lastVerifiedDate": "2026-06-07"
      },
      "desktopUrl": "https://app.powerbi.com/view?r=eyJrIjoiNDU4MjNhOGYtMGM0NS00NDBkLThiM2MtNTA2MDFjNjNkNTliIiwidCI6ImUxMDExZTUyLTcyMTAtNDAxNy05NTBmLTQ1ODA3NWY5Zjg0ZSIsImMiOjh9",
      "mobileUrl": "https://app.powerbi.com/view?r=eyJrIjoiNGZlODE2N2ItYzkwZS00ZWYzLTg2YzctMjg5NWY5MmU1NTkyIiwidCI6ImUxMDExZTUyLTcyMTAtNDAxNy05NTBmLTQ1ODA3NWY5Zjg0ZSIsImMiOjh9",
      "fallbackLayout": "mobile",
      "mobileBreakpoint": 768,
      "routePolicy": {
        "phone": "mobile",
        "tabletPortrait": "mobile",
        "tabletLandscape": "desktop",
        "narrowViewport": "mobile",
        "desktop": "desktop",
        "bot": "desktop"
      },
      "utmContent": "bradamottakan_fossvogi",
      "governance": {
        "ownerTeam": "Landspítali",
        "technicalOwner": "Landspítali mælaborð / vefumsjón",
        "contentOwner": "Landspítali",
        "createdDate": "2026-06-07",
        "lastReviewedDate": "2026-06-07",
        "nextReviewDue": "2026-09-07"
      }
    },
    "thjonustukannanir": {
      "enabled": true,
      "status": "active",
      "dashboardId": "thjonustukannanir-rikisstofnana",
      "dashboardKey": "thjonustukannanir",
      "displayName": "Þjónustukannanir ríkisstofnana",
      "routerDisplayTitle": "Þjónustukannanir ríkisstofnana",
      "powerBiReportTitle": "Þjónustukannanir ríkisstofnana",
      "pageTitle": "Opna Þjónustukannanir ríkisstofnana",
      "commentName": "Þjónustukannanir ríkisstofnana",
      "path": "thjonustukannanir",
      "aliases": [
        "thjonustukannanir",
        "thjon",
        "thjonusta",
        "þjónustukannanir",
        "þjón"
      ],
      "publicCard": {
        "title": "Þjónustukannanir",
        "description": "Niðurstöður þjónustukannana ríkisstofnana hjá Landspítala",
        "buttonText": "Skoða mælaborð",
        "iconUrl": "https://images.ctfassets.net/8k0h54kbe6bj/5eK6Vivq6aUDWj2mnOEsvS/7e5d5e7c03b92370ccee175ad01f8330/survey-linkimage.png?w=774&fm=webp&q=80",
        "pageUrl": "https://island.is/s/landspitali/maelabord",
        "published": true,
        "stableUtmContent": "thjonustukannanir",
        "lastVerifiedDate": "2026-06-07"
      },
      "desktopUrl": "https://app.powerbi.com/view?r=eyJrIjoiN2VjNTI5YzAtMGNjMC00MWQ1LTkwY2MtZTAzMzg2NWI4YTdlIiwidCI6ImUxMDExZTUyLTcyMTAtNDAxNy05NTBmLTQ1ODA3NWY5Zjg0ZSIsImMiOjh9",
      "mobileUrl": "https://app.powerbi.com/view?r=eyJrIjoiNmMyZGI1ZjktOTIzMS00MjZlLWFmMjEtMzE2ZTRhYjcyYmQ3IiwidCI6ImUxMDExZTUyLTcyMTAtNDAxNy05NTBmLTQ1ODA3NWY5Zjg0ZSIsImMiOjh9",
      "fallbackLayout": "mobile",
      "mobileBreakpoint": 768,
      "routePolicy": {
        "phone": "mobile",
        "tabletPortrait": "mobile",
        "tabletLandscape": "desktop",
        "narrowViewport": "mobile",
        "desktop": "desktop",
        "bot": "desktop"
      },
      "utmContent": "thjonustukannanir",
      "governance": {
        "ownerTeam": "Landspítali",
        "technicalOwner": "Landspítali mælaborð / vefumsjón",
        "contentOwner": "Landspítali",
        "createdDate": "2026-06-07",
        "lastReviewedDate": "2026-06-07",
        "nextReviewDue": "2026-09-07"
      }
    }
  }
}
